{
  "appId": "PUBID.go4logistics|AID.go4logistics_go4ultimo|PAPPID.4f2f681f-124e-41a6-b11f-4bf3854f6b61",
  "guid": "4f2f681f-124e-41a6-b11f-4bf3854f6b61",
  "publisherId": "go4logistics",
  "offerId": "go4logistics_go4ultimo",
  "source": {
    "name": "Go4TMS - Ultimo Integration Offering",
    "publisher": "Go4Logistics NV",
    "productType": "DynamicsBC",
    "url": "https://appsource.microsoft.com/en-us/product/dynamics-365-business-central/PUBID.go4logistics%7CAID.go4logistics_go4ultimo%7CPAPPID.4f2f681f-124e-41a6-b11f-4bf3854f6b61",
    "lastModified": "2026-02-02T16:54:35.7468491+00:00",
    "appVersion": "27.0.2602.1646",
    "pricingTypes": [],
    "freeTrial": null,
    "helpLink": "https://www.go4logistics.be/en/help/",
    "sourceHash": "sha256:5fa5f79b1bf9585443a7ed1244322fccc5f04afb48a2a945368d082ca1875bd8",
    "mentionsBC": false
  },
  "mapping": {
    "sourceHash": "sha256:5fa5f79b1bf9585443a7ed1244322fccc5f04afb48a2a945368d082ca1875bd8",
    "mappedOn": null,
    "summary": "Integrates Go4TMS with Ultimo EAM asset maintenance",
    "shape": "addon",
    "primary": [
      {
        "need": "ng-vert-transport-logistics",
        "confidence": "medium"
      },
      {
        "need": "ng-maintenance-planned",
        "confidence": "medium"
      }
    ],
    "secondary": [],
    "claims": [
      "New trucks registered in Ultimo sync to Go4TMS truck card",
      "Planned maintenance synced so planners see available resources"
    ],
    "countries": [],
    "languages": [],
    "industries": [
      "Transport and logistics"
    ],
    "connectsTo": [
      "Ultimo EAM"
    ],
    "requires": [
      "Go4TMS"
    ],
    "deployment": "not_stated",
    "pricing": "not_stated",
    "hide": false,
    "hideReason": "",
    "noFit": ""
  },
  "curated": {
    "overrides": {},
    "locked": false,
    "note": ""
  }
}
