{
  "appId": "PUBID.nm|AID.agriosoftware|PAPPID.0514c11e-b3be-45c9-9fae-e2e1aaa9da1d",
  "guid": "0514c11e-b3be-45c9-9fae-e2e1aaa9da1d",
  "publisherId": "nm",
  "offerId": "agriosoftware",
  "source": {
    "name": "Agrio",
    "publisher": "NEWMINDS",
    "productType": "DynamicsBC",
    "url": "https://appsource.microsoft.com/en-us/product/dynamics-365-business-central/PUBID.nm%7CAID.agriosoftware%7CPAPPID.0514c11e-b3be-45c9-9fae-e2e1aaa9da1d",
    "lastModified": "2026-09-30T13:43:47.5417895+00:00",
    "appVersion": "28.0.1.220",
    "pricingTypes": [
      "ContactPublisher"
    ],
    "freeTrial": null,
    "helpLink": "https://learn.agrio.software/",
    "sourceHash": "sha256:a1f654e9e920703919b0c1e387fe59ce19cdf14bb86a854fc123125cec85c535"
  },
  "mapping": {
    "sourceHash": "sha256:a1f654e9e920703919b0c1e387fe59ce19cdf14bb86a854fc123125cec85c535",
    "mappedOn": null,
    "summary": "Trading and processing of potatoes, onions and vegetables",
    "shape": "vertical",
    "primary": [
      {
        "need": "ng-vert-fresh-produce-horticulture",
        "confidence": "high"
      }
    ],
    "secondary": [
      "ng-admin-portals",
      "ng-production-scheduling",
      "ng-transport-planning"
    ],
    "claims": [
      "Real-time overview of positions",
      "Calculations based on grading and quality",
      "Creates export documents",
      "Portal for growers and consumers",
      "Apps for outdoor workers",
      "Visual production planning",
      "Stores field data incl. new variety development",
      "Plans transport grower to consumer or via own stock",
      "Lab grading and quality data linked",
      "Cloud solution"
    ],
    "countries": [],
    "languages": [],
    "industries": [
      "Agriculture",
      "Fresh produce"
    ],
    "connectsTo": [],
    "requires": [],
    "deployment": "online",
    "pricing": "contact",
    "hide": false,
    "hideReason": "",
    "noFit": ""
  },
  "curated": {
    "overrides": {},
    "locked": false,
    "note": ""
  }
}
