{
  "appId": "PUBID.codeunit|AID.connect2shopware|PAPPID.c9d612db-52c2-45f8-a57b-5cf309502f1e",
  "guid": "c9d612db-52c2-45f8-a57b-5cf309502f1e",
  "publisherId": "codeunit",
  "offerId": "connect2shopware",
  "source": {
    "name": "connect2Shopware",
    "publisher": "Codeunit",
    "productType": "DynamicsBC",
    "url": "https://appsource.microsoft.com/en-us/product/dynamics-365-business-central/PUBID.codeunit%7CAID.connect2shopware%7CPAPPID.c9d612db-52c2-45f8-a57b-5cf309502f1e",
    "lastModified": "2025-06-12T08:39:06.1005449+00:00",
    "appVersion": "25.0.0.0",
    "pricingTypes": [],
    "freeTrial": null,
    "helpLink": "https://www.codeunit.io/get-in-touch",
    "sourceHash": "sha256:ff77d2df2d7bbfd56a1808a81c4110e878c8b603b66b31d11ec2c720ca2a0e16"
  },
  "mapping": {
    "sourceHash": "sha256:ff77d2df2d7bbfd56a1808a81c4110e878c8b603b66b31d11ec2c720ca2a0e16",
    "mappedOn": null,
    "summary": "Integrates Shopware webshop with BC",
    "shape": "connector",
    "primary": [
      {
        "need": "ng-conn-webshop",
        "confidence": "high"
      }
    ],
    "secondary": [],
    "claims": [
      "Includes fully managed and monitored data flows",
      "Fully functional free trial before buying",
      "Setup through BC Assisted Setup with Plug-n-Sell verification",
      "Requires Shopware",
      "Built on Codeunit OmniConnect integration platform"
    ],
    "countries": [],
    "languages": [
      "en"
    ],
    "industries": [],
    "connectsTo": [
      "Shopware"
    ],
    "requires": [
      "Shopware"
    ],
    "deployment": "not_stated",
    "pricing": "subscription",
    "hide": false,
    "hideReason": "",
    "noFit": ""
  },
  "curated": {
    "overrides": {},
    "locked": false,
    "note": ""
  }
}
