{
  "appId": "PUBID.fenwicksoftware|AID.easy-item-tracking-app|PAPPID.7ea65728-04b8-4fbb-8b1c-ae2e650c4d1c",
  "guid": "7ea65728-04b8-4fbb-8b1c-ae2e650c4d1c",
  "publisherId": "fenwicksoftware",
  "offerId": "easy-item-tracking-app",
  "source": {
    "name": "Easy Item Tracking",
    "publisher": "Fenwick",
    "productType": "DynamicsBC",
    "url": "https://appsource.microsoft.com/en-us/product/dynamics-365-business-central/PUBID.fenwicksoftware%7CAID.easy-item-tracking-app%7CPAPPID.7ea65728-04b8-4fbb-8b1c-ae2e650c4d1c",
    "lastModified": "2026-10-06T05:55:16.4914281+00:00",
    "appVersion": "26.0.261006.2",
    "pricingTypes": [],
    "freeTrial": null,
    "helpLink": "https://www.fenwick.com.au/solutions/easy-item-tracking/docs",
    "sourceHash": "sha256:fd5a71bea04ad808b8af1453ec0d72e28c4bed5d31ad5dfc60724fd413c74520"
  },
  "mapping": {
    "sourceHash": "sha256:fd5a71bea04ad808b8af1453ec0d72e28c4bed5d31ad5dfc60724fd413c74520",
    "mappedOn": null,
    "summary": "Shows and edits lot/serial tracking directly on documents and journals",
    "shape": "usability",
    "primary": [
      {
        "need": "ng-lot-serial-traceability",
        "confidence": "high"
      }
    ],
    "secondary": [
      "ng-ux-data-entry"
    ],
    "claims": [
      "Edit expiration dates and lot/serial/package numbers right on document and journal lines",
      "Assign new tracking on outbound lines and select existing tracking on inbound lines from the line",
      "Shows lot/serial and expiration on lines with single tracking; drill-down for multiple",
      "Shows how much of a lot or serial is available or in use",
      "Supports expiration date tracking"
    ],
    "countries": [],
    "languages": [
      "en"
    ],
    "industries": [],
    "connectsTo": [],
    "requires": [],
    "deployment": "not_stated",
    "pricing": "not_stated",
    "hide": false,
    "hideReason": "",
    "noFit": ""
  },
  "curated": {
    "overrides": {},
    "locked": false,
    "note": ""
  }
}
