{
  "appId": "PUBID.wisefish1707821097531|AID.wisefishqualityfishingquotaconnector|PAPPID.add7047d-c8a2-4a77-9ce3-4c7f22eccf0f",
  "guid": "add7047d-c8a2-4a77-9ce3-4c7f22eccf0f",
  "publisherId": "wisefish1707821097531",
  "offerId": "wisefishqualityfishingquotaconnector",
  "source": {
    "name": "Wisefish Quality Fishing and Quota Connector",
    "publisher": "Wisefish",
    "url": "https://appsource.microsoft.com/en-us/product/dynamics-365-business-central/PUBID.wisefish1707821097531%7CAID.wisefishqualityfishingquotaconnector%7CPAPPID.add7047d-c8a2-4a77-9ce3-4c7f22eccf0f",
    "lastModified": "2026-03-31T18:13:18.7706801+00:00",
    "appVersion": "24.1.20260331.21",
    "pricingTypes": [],
    "freeTrial": null,
    "helpLink": "https://www.wisefish.com/contact",
    "sourceHash": "sha256:50f4231c2bfe9c5c0b0e04028098095bd3fa3378f66aecd7d4aa30b64b711341"
  },
  "mapping": {
    "sourceHash": "sha256:50f4231c2bfe9c5c0b0e04028098095bd3fa3378f66aecd7d4aa30b64b711341",
    "mappedOn": null,
    "summary": "Quality inspections and quota connector for Wisefish",
    "shape": "addon",
    "primary": [
      {
        "need": "ng-vert-seafood",
        "confidence": "high"
      },
      {
        "need": "ng-quality-inspection",
        "confidence": "medium"
      }
    ],
    "secondary": [
      "ng-vert-food-beverage"
    ],
    "claims": [
      "Connects Wisefish Quality with the Wisefish Fishing and Quota solution",
      "User-defined quality inspections",
      "Supports HACCP (Hazard Analysis and Critical Control Points)",
      "Lets users define their own quality inspection parameters",
      "Applies quality controls to produced goods and production lots",
      "Suitable for fish, meat, dairy and beverage producers",
      "Supports Essential and Premium editions"
    ],
    "countries": [
      "DK",
      "IS",
      "NO",
      "US"
    ],
    "languages": [
      "en",
      "is"
    ],
    "industries": [
      "Food and beverage",
      "Seafood"
    ],
    "connectsTo": [
      "Wisefish Quality",
      "Wisefish Fishing and Quota"
    ],
    "requires": [
      "Wisefish",
      "Wisefish Quality"
    ],
    "deployment": "not_stated",
    "pricing": "not_stated",
    "hide": false,
    "hideReason": "",
    "noFit": ""
  },
  "curated": {
    "overrides": {},
    "locked": false,
    "note": ""
  }
}
