{
  "appId": "TYPE.connect|PUBID.knowledgemanagementsolutionspteltd1686120493035|AID.commodity_trading|PAPPID.73cdff8c-3017-4e4e-be8a-cf02e2e0f828",
  "guid": "73cdff8c-3017-4e4e-be8a-cf02e2e0f828",
  "publisherId": "knowledgemanagementsolutionspteltd1686120493035",
  "offerId": "commodity_trading",
  "source": {
    "name": "Trace LCM",
    "publisher": "Knowledge Management Solutions Pte Ltd",
    "productType": "DynamicsBC",
    "url": "https://appsource.microsoft.com/en-us/product/dynamics-365-business-central/TYPE.connect%7CPUBID.knowledgemanagementsolutionspteltd1686120493035%7CAID.commodity_trading%7CPAPPID.73cdff8c-3017-4e4e-be8a-cf02e2e0f828",
    "lastModified": "2024-11-22T03:50:28.5159387+00:00",
    "appVersion": "1.0.1.1",
    "pricingTypes": [],
    "freeTrial": null,
    "helpLink": "https://kms-world.com/trade-lcm/",
    "sourceHash": "sha256:faf1bb66389eb0fa25bf4c0351a260a34b8e9cc2591412208c46a4cd8010febc",
    "mentionsBC": false
  },
  "mapping": {
    "sourceHash": "sha256:faf1bb66389eb0fa25bf4c0351a260a34b8e9cc2591412208c46a4cd8010febc",
    "mappedOn": null,
    "summary": "Manages treasury, freight and commodity trade",
    "shape": "vertical",
    "primary": [
      {
        "need": "ng-vert-wholesale-trading",
        "confidence": "high"
      }
    ],
    "secondary": [
      "ng-shipping-carriers",
      "ng-cash-forecast"
    ],
    "claims": [
      "Contract management for commodity trading and processing",
      "Delivered as software-as-a-service",
      "Manages the full commodity trade lifecycle in one interface",
      "Covers contracts, trade execution, shipping and accounting",
      "Commodity trade, freight and treasury management"
    ],
    "countries": [],
    "languages": [],
    "industries": [
      "Commodity trading"
    ],
    "connectsTo": [],
    "requires": [],
    "deployment": "online",
    "pricing": "not_stated",
    "hide": false,
    "hideReason": "",
    "noFit": ""
  },
  "curated": {
    "overrides": {},
    "locked": false,
    "note": ""
  }
}
