{
  "appId": "PUBID.markmannmllerdatensystemegmbh1610701000601|AID.mumdat_ext_text_module_digital_metal_code|PAPPID.949785ba-f7f3-427a-9f35-176266eb8e5e",
  "guid": "949785ba-f7f3-427a-9f35-176266eb8e5e",
  "publisherId": "markmannmllerdatensystemegmbh1610701000601",
  "offerId": "mumdat_ext_text_module_digital_metal_code",
  "source": {
    "name": "m+m Ext. Text Module with Digital Metal Code",
    "publisher": "Markmann + Müller Datensysteme GmbH",
    "productType": "DynamicsBC",
    "url": "https://appsource.microsoft.com/en-us/product/dynamics-365-business-central/PUBID.markmannmllerdatensystemegmbh1610701000601%7CAID.mumdat_ext_text_module_digital_metal_code%7CPAPPID.949785ba-f7f3-427a-9f35-176266eb8e5e",
    "lastModified": "2026-10-02T12:53:58.0212596+00:00",
    "appVersion": "28.0.373578.0",
    "pricingTypes": [
      "ContactPublisher"
    ],
    "freeTrial": null,
    "helpLink": "https://www.mumdat.de/appsource",
    "sourceHash": "sha256:e7ffe0da865a903e6c4a928fb3d81ef9ef2350a5de25ea8ecfdfa504c3d0f16b"
  },
  "mapping": {
    "sourceHash": "sha256:e7ffe0da865a903e6c4a928fb3d81ef9ef2350a5de25ea8ecfdfa504c3d0f16b",
    "mappedOn": "2026-10-07",
    "summary": "Adds Digital Metal Code QR and Code39 barcodes to m+m extended texts",
    "shape": "addon",
    "primary": [
      {
        "need": "ng-barcode-labels",
        "confidence": "low"
      }
    ],
    "secondary": [
      "ng-vert-metal-timber-materials"
    ],
    "claims": [
      "IDMC QR code and Code39 placeholders in extended texts",
      "Reuses cached barcode images or generates them on the fly",
      "Requires BC Premium"
    ],
    "countries": [
      "AT",
      "BE",
      "CH",
      "CZ",
      "DE",
      "DK",
      "FR",
      "GB",
      "IT",
      "LV",
      "NL",
      "PL",
      "US"
    ],
    "languages": [
      "de",
      "en"
    ],
    "industries": [],
    "connectsTo": [],
    "requires": [
      "m+m Extended Text Module",
      "m+m Digital Metal Code"
    ],
    "deployment": "not_stated",
    "pricing": "contact",
    "hide": false,
    "hideReason": "",
    "noFit": ""
  },
  "curated": {
    "overrides": {},
    "locked": false,
    "note": ""
  }
}
