{
  "appId": "PUBID.yazlmvedanmanlkhizmetlerianonimirketi1684754676139|AID.einvoice|PAPPID.5a3acd16-f404-4cf0-af7d-ea80a7c5f531",
  "guid": "5a3acd16-f404-4cf0-af7d-ea80a7c5f531",
  "publisherId": "yazlmvedanmanlkhizmetlerianonimirketi1684754676139",
  "offerId": "einvoice",
  "source": {
    "name": "E-Invoice & E-Archive",
    "publisher": "Myron Yazılım Ve Danışmanlık Hizmetleri Anonim Şirketi",
    "productType": "DynamicsBC",
    "url": "https://appsource.microsoft.com/en-us/product/dynamics-365-business-central/PUBID.yazlmvedanmanlkhizmetlerianonimirketi1684754676139%7CAID.einvoice%7CPAPPID.5a3acd16-f404-4cf0-af7d-ea80a7c5f531",
    "lastModified": "2026-10-06T13:15:41.640686+00:00",
    "appVersion": "1.28.0.9",
    "pricingTypes": [
      "ContactPublisher"
    ],
    "freeTrial": null,
    "helpLink": "https://myronsoft.com.tr/en/contact/",
    "sourceHash": "sha256:174cdffb33012c541afbad8fa1b176930713fa791694f7d024438ff0b65bdba7",
    "mentionsBC": true
  },
  "mapping": {
    "sourceHash": "sha256:174cdffb33012c541afbad8fa1b176930713fa791694f7d024438ff0b65bdba7",
    "mappedOn": null,
    "summary": "Turkish e-invoice and e-archive",
    "shape": "localization",
    "primary": [
      {
        "need": "ng-loc-einvoicing",
        "confidence": "high"
      }
    ],
    "secondary": [
      "ng-ap-invoice-capture",
      "ng-sales-invoicing"
    ],
    "claims": [
      "Sends and receives e-invoices",
      "Creates E-Archive and E-Invoice documents from posted invoices",
      "Automatically sends created E-Archive and E-Invoices",
      "Queries delivery status of e-invoices to customers and vendors",
      "Creates purchase invoices automatically from incoming e-invoices",
      "PDF printouts of incoming invoices",
      "Automatically detects whether customers/vendors are in e-invoice scope",
      "Prevents sending paper invoices",
      "Supports Essential and Premium editions",
      "Available in English (US) and Turkish"
    ],
    "countries": [
      "TR"
    ],
    "languages": [
      "en",
      "tr"
    ],
    "industries": [],
    "connectsTo": [],
    "requires": [],
    "deployment": "not_stated",
    "pricing": "contact",
    "hide": false,
    "hideReason": "",
    "noFit": ""
  },
  "curated": {
    "overrides": {},
    "locked": false,
    "note": ""
  }
}
