{
  "appId": "PUBID.youngpartners1588093205397|AID.navitrans_365_invisio|PAPPID.a279c980-ce11-4058-9a03-9f07021a4241",
  "guid": "a279c980-ce11-4058-9a03-9f07021a4241",
  "publisherId": "youngpartners1588093205397",
  "offerId": "navitrans_365_invisio",
  "source": {
    "name": "Navitrans 365 Invisio",
    "publisher": "Navitrans",
    "productType": "DynamicsBC",
    "url": "https://appsource.microsoft.com/en-us/product/dynamics-365-business-central/PUBID.youngpartners1588093205397%7CAID.navitrans_365_invisio%7CPAPPID.a279c980-ce11-4058-9a03-9f07021a4241",
    "lastModified": "2026-09-30T20:04:02.3306615+00:00",
    "appVersion": "28.5.0.80061",
    "pricingTypes": [],
    "freeTrial": null,
    "helpLink": "https://www.navitrans.eu/our-services/tms/",
    "sourceHash": "sha256:0b625ce76626f3bdb2043904819b8bf23c205659e8e47a35bdeb8861df3639bb"
  },
  "mapping": {
    "sourceHash": "sha256:0b625ce76626f3bdb2043904819b8bf23c205659e8e47a35bdeb8861df3639bb",
    "mappedOn": null,
    "summary": "Invisio module for Navitrans 365",
    "shape": "addon",
    "primary": [
      {
        "need": "ng-vert-transport-logistics",
        "confidence": "medium"
      }
    ],
    "secondary": [],
    "claims": [
      "Navitrans 365 module/connector named in listing",
      "Part of Navitrans 365 TMS covering order registration to invoicing",
      "FTL and LTL transport orders created from templates",
      "Planning tools with capacity, combination and qualification checks",
      "Pricing runs automatically off tariff tables or flat prices",
      "Works with subcontractors and charters",
      "Automatic invoicing combining orders on invoices",
      "Supports Essentials and Premium"
    ],
    "countries": [
      "AT",
      "BE",
      "CH",
      "CZ",
      "DE",
      "DK",
      "EE",
      "FI",
      "FR",
      "GB",
      "HR",
      "HU",
      "IE",
      "IS",
      "LT",
      "LV",
      "NL",
      "NO",
      "PL",
      "SE",
      "SI"
    ],
    "languages": [
      "en"
    ],
    "industries": [],
    "connectsTo": [],
    "requires": [
      "Navitrans 365"
    ],
    "deployment": "not_stated",
    "pricing": "not_stated",
    "hide": false,
    "hideReason": "",
    "noFit": ""
  },
  "curated": {
    "overrides": {},
    "locked": false,
    "note": ""
  }
}
