{
  "appId": "PUBID.foodware365|AID.external_sales|PAPPID.b369918d-1b24-442d-bd0f-a21ef3e6c4d9",
  "guid": "b369918d-1b24-442d-bd0f-a21ef3e6c4d9",
  "publisherId": "foodware365",
  "offerId": "external_sales",
  "source": {
    "name": "Aptean External Sales for Food and Beverage",
    "publisher": "Aptean",
    "productType": "DynamicsBC",
    "url": "https://appsource.microsoft.com/en-us/product/dynamics-365-business-central/PUBID.foodware365%7CAID.external_sales%7CPAPPID.b369918d-1b24-442d-bd0f-a21ef3e6c4d9",
    "lastModified": "2026-01-19T09:15:23.3000364+00:00",
    "appVersion": "2503.0.287237.0",
    "pricingTypes": [],
    "freeTrial": null,
    "helpLink": "https://fnbdocs.apteancloud.com/bc/EXS/",
    "sourceHash": "sha256:e39b6683e053362acef272390f572d322711e601f598deb28bbbce250eb8b27a",
    "mentionsBC": true
  },
  "mapping": {
    "sourceHash": "sha256:e39b6683e053362acef272390f572d322711e601f598deb28bbbce250eb8b27a",
    "mappedOn": null,
    "summary": "Manages indirect sales between customers and third parties",
    "shape": "process",
    "primary": [
      {
        "need": "ng-customer-rebates",
        "confidence": "high"
      },
      {
        "need": "ng-vert-food-beverage",
        "confidence": "medium"
      }
    ],
    "secondary": [
      "ng-sales-commissions",
      "ng-ux-import-excel"
    ],
    "claims": [
      "External sales orders representing customers' sales of your items",
      "Trade accruals based on external sales",
      "Trade statements via Aptean Trade Management integration",
      "Indirect sales with shifting accounts receivable",
      "Import external sales from Excel or CSV"
    ],
    "countries": [
      "AU",
      "BE",
      "BG",
      "CA",
      "CH",
      "DE",
      "DK",
      "ES",
      "FR",
      "GB",
      "ID",
      "IE",
      "IN",
      "MX",
      "MY",
      "NL",
      "NO",
      "NZ",
      "PH",
      "PL",
      "SE",
      "SG",
      "TH",
      "US",
      "VN",
      "ZA"
    ],
    "languages": [
      "da",
      "de",
      "en",
      "es",
      "fr",
      "nl"
    ],
    "industries": [
      "Food and beverage"
    ],
    "connectsTo": [],
    "requires": [],
    "deployment": "not_stated",
    "pricing": "free_trial",
    "hide": false,
    "hideReason": "",
    "noFit": ""
  },
  "curated": {
    "overrides": {},
    "locked": false,
    "note": ""
  }
}
