{
  "appId": "optimizersbv.app4sales",
  "guid": null,
  "publisherId": "optimizersbv",
  "offerId": "app4sales",
  "source": {
    "name": "App4Sales",
    "publisher": "Optimizers B.V.",
    "productType": "SaaS",
    "url": "https://appsource.microsoft.com/en-us/product/web-apps/optimizersbv.app4sales",
    "lastModified": "2025-12-26T11:00:01.5299167+00:00",
    "appVersion": "1.0",
    "pricingTypes": [],
    "freeTrial": null,
    "helpLink": null,
    "sourceHash": "sha256:f0c43f7efaa47e7af3c7db07538f7953adf102e5a7cab654971c1e29f140fac6",
    "mentionsBC": true
  },
  "mapping": {
    "sourceHash": "sha256:f0c43f7efaa47e7af3c7db07538f7953adf102e5a7cab654971c1e29f140fac6",
    "mappedOn": "2026-10-07",
    "summary": "Mobile B2B sales app for reps: offline orders, live stock and prices, customer signatures",
    "shape": "platform",
    "primary": [
      {
        "need": "ng-sales-order-entry",
        "confidence": "high"
      }
    ],
    "secondary": [
      "ng-crm-accounts",
      "ng-assortment-catalogs"
    ],
    "claims": [
      "Order entry on mobile devices, also offline",
      "Create new customers from the app",
      "Customers sign orders on iPad or Android",
      "Real-time stock and price information",
      "Sends order confirmations",
      "Visual lookbook catalog",
      "Supports BC Essentials and Premium"
    ],
    "countries": [
      "AT",
      "AU",
      "BE",
      "CA",
      "CH",
      "CZ",
      "DE",
      "DK",
      "ES",
      "FI",
      "FR",
      "GB",
      "IS",
      "IT",
      "MX",
      "NL",
      "NO",
      "NZ",
      "RU",
      "SE",
      "US"
    ],
    "languages": [],
    "industries": [
      "Distribution",
      "Retail & Consumer Goods"
    ],
    "connectsTo": [],
    "requires": [],
    "deployment": "online",
    "pricing": "not_stated",
    "hide": false,
    "hideReason": "",
    "noFit": ""
  },
  "curated": {
    "overrides": {},
    "locked": false,
    "note": ""
  }
}
