{
  "appId": "PUBID.microcloud360ptyltd1579690308764|AID.microcloud360-002|PAPPID.ce955440-8f7b-4825-8b97-67476027d53f",
  "guid": "ce955440-8f7b-4825-8b97-67476027d53f",
  "publisherId": "microcloud360ptyltd1579690308764",
  "offerId": "microcloud360-002",
  "source": {
    "name": "Business Central Address Validation with Google",
    "publisher": "MicroCloud 360 Pty Ltd",
    "productType": "DynamicsBC",
    "url": "https://appsource.microsoft.com/en-us/product/dynamics-365-business-central/PUBID.microcloud360ptyltd1579690308764%7CAID.microcloud360-002%7CPAPPID.ce955440-8f7b-4825-8b97-67476027d53f",
    "lastModified": "2026-04-23T02:57:58.5649696+00:00",
    "appVersion": "1.0.0.0",
    "pricingTypes": [
      "FreeTrial",
      "Payg"
    ],
    "freeTrial": "1 Month",
    "helpLink": "https://microcloud360.com.au/contact-us",
    "sourceHash": "sha256:beefa90afa6a57d1527e3ceeba564eafe16c1422d085f11363d62beb094222a7",
    "mentionsBC": true
  },
  "mapping": {
    "sourceHash": "sha256:beefa90afa6a57d1527e3ceeba564eafe16c1422d085f11363d62beb094222a7",
    "mappedOn": null,
    "summary": "Validates and autocompletes addresses with Google Maps",
    "shape": "connector",
    "primary": [
      {
        "need": "ng-ux-data-quality",
        "confidence": "high"
      },
      {
        "need": "ng-conn-company-data",
        "confidence": "medium"
      }
    ],
    "secondary": [
      "ng-crm-accounts"
    ],
    "claims": [
      "Real-time address autocomplete via Google Places API",
      "Verifies addresses visually using an embedded Google Maps view",
      "Standardized address formats",
      "Validates addresses on contacts, customers, vendors, company information, locations and ship-to addresses",
      "No address data stored; API keys masked",
      "Requires BC cloud version 21 or later"
    ],
    "countries": [],
    "languages": [],
    "industries": [
      "Distribution",
      "Manufacturing"
    ],
    "connectsTo": [
      "Google Maps"
    ],
    "requires": [],
    "deployment": "online",
    "pricing": "free_trial",
    "hide": false,
    "hideReason": "",
    "noFit": ""
  },
  "curated": {
    "overrides": {},
    "locked": false,
    "note": ""
  }
}
